{
  "aprd_ref": ".aprd/aprd.v2.frozen.md",
  "extraction_ref": ".aprd/02-extraction.json",
  "gaps_ref": ".aprd/04-gaps.json",
  "answers_ref": ".aprd/06-answers.md",
  "class": "bugfix",
  "baseline_aprd_ref": ".aprd/aprd.frozen.md",
  "aprd_version": "v2",
  "assumptions": [
    {
      "id": "A14",
      "gap_ref": "G1",
      "text": "Null billable_rate renders as blank placeholder em-dash ('—') in rate column; the row renders, no numeric format applied to null value.",
      "source": "default-applied",
      "chosen_interpretation": "Render a null billable_rate as a blank placeholder (an em-dash '—') in the rate column; the row renders, no numeric format applied to a null value.",
      "rejected_interpretations": [
        "Render a null billable_rate as zero ('0.00') in the rate column, formatted like any numeric rate.",
        "Omit the rate field entirely for a null-rate project; the row renders name and currency only."
      ]
    }
  ],
  "flagged_requirements": [],
  "assumption_count": 1,
  "touch_set": [
    {
      "kind": "blast-radius",
      "slices": ["S4"],
      "requirements": ["R11"],
      "note": "Fix edits _ProjectManagementAdapter._render in C3 (src/freelancer_app/wsgi.py) — the S4 surface. R11 repro requirement asserts correct behavior baseline R6 is violated by. RE-RANK rebuilds S4."
    }
  ]
}
